tweet_id,tweet_url,tweet_text,stance,persuasiveness,split
1372936384034447366,https://t.co/FpkVZ8ESy0,"More Asian-Americans Are Buying Guns For Protection From Hate Crime https://t.co/FpkVZ8ESy0

But @JoeBiden and @TheDemocrats want to deny them their #secondamendment right to do so? 

#hmm

#2A #2ndamendment #gunrights #violentcrime #publicsafety #copolitics 
@WhiteHouse https://t.co/qfew6mEeH4",oppose,no,train
1327310308260667393,https://t.co/KrJTpJR3Ke,"""I will protect your Bill of Rights. Gun control is a recipe for only the criminals having guns. I am a member of the NRA and the Nebraska Firearms Owners Association and proud of it."" - Don Bacon
 #Congress #AirForce https://t.co/KrJTpJR3Ke",oppose,no,train
1334523148692312065,https://t.co/hBAV1pPCY9,#guns #2A 6-Time Olympic Shooting Medalist Says Gun Control Is ‘Killing Our Sport’: Six-time Olympic shooting medalist Kim Rhode said Monday night that new gun control measures implemented in her home state of California — an https://t.co/hBAV1pPCY9 https://t.co/c2SSTPuGHU,oppose,no,train
1324087921641721856,https://t.co/LfIzR6iPA3,"Congratulations @ForHD65 on your victory! 

We’re proud to endorse a strong advocate who believes in our movement for gun safety, in the efficacy of universal background checks, and keeping the families of Texas’ #HD65 safe from gun violence. https://t.co/LfIzR6iPA3",support,no,train
1313162243035607040,https://t.co/MZyeIP6Mtx,"Dr. Cindy Banyai supports common sense gun safety laws that will save lives.  Her opponent, brags that he stood up against the bipartisan gun safety laws Florida passed after the tragedy in Parkland.

✔️Banyai for #FL15

Support @SWFLMom2020 

#ONEV1 #BlueDot #EndGunViolence https://t.co/MZyeIP6Mtx",support,no,train
1357140892658798592,https://t.co/MWcgPTA1zj,"The beauty of the second amendment is that it will not be needed until they try and take it.
#2ndAmendment #Beauty #Freedom #Audilust #Legholster #Gungirl #Girlwithtattoos https://t.co/MWcgPTA1zj",oppose,no,train
1375928615217545218,https://t.co/6qbFwEXGZ7,"Is there a gun epidemic in America?. Well, let's look at the numbers and compare gun deaths vs other causes of death.
THERE IS NO GUN EPIDEMIC IN AMERICA. The government should  invest in preventing/solving common causes of death killing millions.
#GunControl #2ndAmendment https://t.co/6qbFwEXGZ7",oppose,yes,train
1321992651923742722,https://t.co/Oj7XzAK2ht,peaceful protests can lead to gun control. pass it on https://t.co/Oj7XzAK2ht,support,yes,train
1340442042992877573,https://t.co/Iii94A2DI0,"Get 'The Second Amendment' (Unisex) Sweater, Today! ""A well regulated Militia, being necessary to the security of a free State, the right of the people to keep and bear Arms, shall not be infringed."" https://t.co/Iii94A2DI0 https://t.co/hYkd2cpti1",oppose,no,train
1363955305982402563,https://t.co/W8WeeqhCtl,"Just saying... guns save lives more than take them. But this logic will not be repeated by the likes of @MomsDemand.

#NRA #Gunsense #liberty #racism #scotus #2ndamendment #libertarian #Democrats #molonlabe https://t.co/W8WeeqhCtl",oppose,yes,train
1357697991822503937,https://t.co/oxb6rn9yXr,"By early February, more people are killed with guns in the US than are killed with guns in other high-income countries in the entire year.

It is past time that we gain bipartisan support for commonsense gun reform in Pennsylvania.

#GVSurvivorsWeek https://t.co/oxb6rn9yXr",support,no,train
1374542539127103492,https://t.co/oOTuIUrxim,The only people/organization that has fed the lie that democrats are going to take your guns are the gop and the nra. Democrats and republicans alike want common sense gun laws. Period! Law abiding people don't mind waiting 3 days to purchase a gun. Pass the law!!! Fuck the NRA! https://t.co/oOTuIUrxim,support,no,train
1375829438575779843,https://t.co/0bDFzM7rh5,Idea for a gun law. Those whiners would be losing their 💩 if this was forced on them. let's DO IT. https://t.co/0bDFzM7rh5,support,yes,train
1318708474591776768,https://t.co/jysw20iu2q,"Firearms are the leading cause of death for American children and teens. By implementing gun control laws, we would protect the children, not the guns.

Let our voices be heard. #EndGunviolence #GunSafety #mcpromoteswomensrights https://t.co/jysw20iu2q",support,no,train
1338521073961365506,https://t.co/Y3Qu1bjn3S,26. 26 lives taken 8 years ago like they were nothing. Innocent children and brave adults who died trying to protect them. Senseless. Tragic. Heartbreaking. Look at the faces and ask yourself why we can’t agree that we need gun control. It’s not about rights...it’s about KIDS.💔 https://t.co/Y3Qu1bjn3S,support,no,train
1370187627765374980,https://t.co/TFNeqPx22r,We need a voters ID long before an ID to purchase a firearm. It’s also unconstitutional and goes against our 2nd amendment. https://t.co/TFNeqPx22r,oppose,no,train
1375105271907815424,https://t.co/squME0wY9D,"Background checks save lives. Full stop. 
We deserve #MoreThanThoughtsAndPrayers from our elected leaders to end gun violence. Text CHECKS to 644-33 to demand your senators take action on background checks NOW. @MomsDemand https://t.co/squME0wY9D",support,no,train
1345391919095033863,https://t.co/0NUceCAo4s,"""If the opposition disarms, well and good. If it refuses to disarm, we shall disarm it ourselves.""
-Joseph Stalin, 1927
#communism #guncontrol #shit_authoritarians_say https://t.co/0NUceCAo4s",oppose,no,train
1374533451462873090,https://t.co/Xqc6IOMdAC,"The 2nd Amendment is the last defense against tyrannical authoritarian government. Taking away the ability for a free people to purchase firearms is a red flag that everyone needs to pay attention to.

#2ndAmendment #2A #RightToBearArms #ConsitutionalRight #Freedom https://t.co/Xqc6IOMdAC",oppose,no,train
1324005515219947525,https://t.co/jdOlV7Xpys,".@lucymcbath has emerged victorious in #GA06! 

She has proven to be a gun safety champion for her community. Now more than ever, we need someone with her courage and strength in Congress. https://t.co/jdOlV7Xpys",support,no,train
1346836374004113408,https://t.co/Jc41kU9zkM,"If Ossoff wins the Georgia senate seat, our second amendment rights are toast. Better lose your guns in a boating accident. That’s happened to me last weekend. #2A #biden cc: @RepThomasMassie @PeteSessions @RandPaul https://t.co/Jc41kU9zkM",oppose,no,train
1367993482028138497,https://t.co/iHp5mLM9j5,.@JoeBiden When it comes to gun control here is an option that you should try. Create a nationwide constitutional carry permit. That way law abiding citizens can move freely from state to state. Stop trying penalize us for exercising our 2nd Amendment rights. @Unitedminingal https://t.co/iHp5mLM9j5,oppose,no,train
1325007657170857984,https://t.co/2fXfmtirLe,"""Assembly Bill 2847 solves no problems but creates yet another gun control hurdle for law-abiding firearm manufacturers and the consumers that rely on their products."" | https://t.co/2fXfmtirLe https://t.co/mEJ8QskeY0",oppose,no,train
1350560411943383040,https://t.co/cuO3ff3vgW,"WHAT IS THIS?

ANOTHER ATTEMPT BY WASHINGTON AND CONGRESS MEMBERS TO (CRIMINALIZE) THE AMERICAN PEOPLE FOR FOLLOWING THE SECOND AMENDMENT, AND A (MILITIA'S) WAYS WHEN THEY ARE ALL HIGH TREASON WITH THE FEDERAL BUREAU OF INVESTIGATIONS WAY'S... https://t.co/cuO3ff3vgW",oppose,no,train
1374564630106759170,https://t.co/iKxVrGZHRX,"We don’t have to live like this. And we do not need to accept nor normalize gun violence as just part of our daily American lives. We have a right to live free from the fear of gun violence in all forms. Take action. 

#EndGunViolence #KeepGoing #SurvivorStrong #ForJunior https://t.co/iKxVrGZHRX",support,yes,train
1338686569289494529,https://t.co/VCDqgILoAI,"Every time I look at these pictures it breaks my heart and makes me so angry--8 years later and no commonsense gun laws! When will change happen?
💔#SandyHook #EndGunViolence https://t.co/VCDqgILoAI",support,yes,train
1365496881950859265,https://t.co/NmfJWnbpyN,"""The People have a right to keep and bear Arms; that a well regulated Militia, composed of the Body of the People, trained to arms, is the proper, natural, and safe Defence of a free state."" George Mason, Father of our 2nd Amendment

Your friends ➡️ https://t.co/NmfJWnbpyN https://t.co/CmApOOBh0i",oppose,yes,train
1320954028981846017,https://t.co/cW5II2TjhL,"This situation just occurred today in Texas, USA.

This once again proves how many lives could be saved just through passing stronger gun control and reform laws throughout the entire United States.

We in @FreestoneGov are not enough.
Americans, please vote wisely! https://t.co/cW5II2TjhL",support,yes,train
1369706919779315719,https://t.co/9wk3Y1FYCw,"I will always defend our 2nd Amendment rights.
 
HR8 is radical gun control that does nothing to stop criminals from getting firearms. 

It creates a national gun registry and makes it harder for law abiding North Dakotans to exercise their 2A rights. https://t.co/9wk3Y1FYCw",oppose,no,train
1318939979540799488,https://t.co/YFKJ0JD0Bs,Gun violence has plagued our country for far too long. Common sense gun safety can and must happen. Weapons of war don’t belong on our streets. I’m proud to be supported by those taking on the corporate gun lobby to end gun violence. https://t.co/YFKJ0JD0Bs,support,no,train
1327673361032486915,https://t.co/SL18vrkwdE,"The anti gun groups don’t like to talk about this one. This happened 2019. Crazy thing is, the anti-gunners didn’t blame the gun they blamed it on her going through a hard divorce. Gun control is not about saving lives it’s about CONTROL.

Full article: https://t.co/SL18vrkwdE https://t.co/FhUnQVbesg",oppose,yes,train
1357142533768380416,https://t.co/S7gIwlHCtp,We can honor the constitutionality of the 2nd Amend &amp; also have reasonable restrictions. This #GunViolenceSurvivorsWeek here are 5 common sense gun reform efforts that have broad support and will definitely save lives. Thanks to @GunSurvivors @GiffordsCourage &amp;  @thephilacitizen https://t.co/S7gIwlHCtp,support,yes,train
1314264056983965699,https://t.co/boeaYKF7yL,"Every year, 40,000 people in America are killed with guns. Think about those healthcare costs— it's astronomic. And lifelong. We cannot afford another Supreme Court justice who will roll back both gun safety laws and our healthcare access. #BlockBarrett #WeDissent #EndGunViolence https://t.co/boeaYKF7yL",support,no,train
1375097688987947013,https://t.co/O2AnlrXO7l,"People in America have the right to life, liberty, and the pursuit of happiness without the fear of being gunned down.

Text CHECKS to 644-33 to tell your senators to take action on gun safety legislation NOW. https://t.co/O2AnlrXO7l",support,no,train
1363549506411847681,https://t.co/GoY4QDrkYY,"In the fifteen years before the introduction of Australia’s gun control laws, there were thirteen mass shootings in Australia that resulted in the deaths of one hundred and four people. 

In 1984, there was the Brandon and Bull murder and suicide. 

https://t.co/GoY4QDrkYY https://t.co/aNfdTWNlDA",support,no,train
1316481779075674112,https://t.co/QRrQ3v9oOI,"You Will Be Shocked By How Many Gun Control Proposals Biden And Kamala Marmalade Put In Their New Party Platform - REMEMBER: When HITLER took over Germany and Stalin took over the Soviet Union, the first thing they did, is disarm the populace! Mao Zedong did the same! https://t.co/QRrQ3v9oOI",oppose,no,train
1370033395171012609,https://t.co/1ezNNd6oYg,#guns #2A States Staying On Top Of Gun Control Issues: … of an attack on our Second Amendment gun rights as well. Oklahoma State … staying in the know on gun rights issues. â€œWeâ€™re … past us on this Second Amendme https://t.co/1ezNNd6oYg https://t.co/BbBrjgiSNE,oppose,no,train
1362182975408889862,https://t.co/gId3DJnKhD,"""With all this #GunControl talk, I haven't heard one politician say how they plan to take guns from criminals, just law abiding citizens."" #BidenCrimeFamilly https://t.co/gId3DJnKhD",oppose,no,train
1315259793855123456,https://t.co/Ys8mddKCKd,"I sincerely appreciate this endorsement from the News &amp; Observer.

From the editorial: “Wiley Nickel... is among the Senate’s most progressive members. He has pushed for improved unemployment benefits and supports stronger gun control laws and an end to gerrymandering.” https://t.co/Ys8mddKCKd",support,no,train
1362122700630593538,https://t.co/JrlU9CwDYy,"“No legal gun owners' rights have been violated, but unnecessary, dangerous weapons are off the streets and dangerously mentally ill people cannot by guns.”

Governor Andrew M. Cuomo

Red Flag Gun Safety Conference
 October 26, 2019 #GunLawReform #MakeAmericaSafer https://t.co/JrlU9CwDYy",support,no,train
1332119362082279424,https://t.co/J0bNDZkfMM,"In much the same way the movable type printing press murdered #censorship and then the internet buried it, #guncontrol / #gunsense is dead at the hands of #3Dprinting.  

I can print as many of these normal-capacity magazines as I want, and there's /nothing/ you can do to stop me https://t.co/J0bNDZkfMM",oppose,no,train
1366299315732422667,https://t.co/XADMeGbqWo,"#GunControl is a distraction. 
#AmmunitionControl is the real issue. 

Guns don't necessarily do the killing in a shooting. Even the hands, hearts and minds of the shooters don't necessarily do the killing.

No.

The Bullet Does All The Killing 
#AmmunitionControl https://t.co/XADMeGbqWo",support,no,train
1361120748006424576,https://t.co/BT7VBRA033,Of course Q nut MTG would tweet about the need for gun free school zones on the anniversary of the Parkland shootings. We wouldn't need gun free school zones if we had sensible gun control. https://t.co/BT7VBRA033,support,no,train
1346950933104783362,https://t.co/AltYzU2ZeE,"Kuna declares itself Second Amendment sanctuary. So clearly I will not support #Eagle #Kuna or #Star by spending $$ within city limits. No gas, no food, no clothes or services. https://t.co/AltYzU2ZeE via @theidahopress #GunsAreNotTheAnswer to your insecurities. https://t.co/sMVDwlJ7Uz",support,no,train
1363776961164713987,https://t.co/UXlXJPW7Fv,"SpecOps fantasies?

On the flip side, a LOT of Americans aren't safe in their own yards due to the local wildlife - including crocodiles, wild boars/feral pigs, grizzly bears, wolves, venomous snakes...

Not everybody lives in the suburbs.

No federal gun law can apply to all... https://t.co/UXlXJPW7Fv",oppose,no,train
1362811795581374465,https://t.co/vm38qn5XOP,"Second dose of my Covid vax is kicking my butt, but Moms gotta Mom. 

Text SC to 644-33 &amp; tell your legs to OPPOSE HB3094, the totally unnecessary Open Carry bill. It's moving fast and will make us ALL less safe.

@MomsDemand #SCPol https://t.co/vm38qn5XOP",support,no,train
1348463854942965764,https://t.co/AcAz93rXSL,"Then the NRA &amp; 2nd Amendment right to self-defense, castle doctrine &amp; legal carry! Bullets are already vanishing. Police are never there before a crime. You’ll have to have government unlock your gun while the perp shoots your family #BidenCheated https://t.co/AcAz93rXSL",oppose,no,train
1374578316468965378,https://t.co/ZrNT1iRA84,"Repost • giffordscourage 
Fact: Gun safety laws save lives.
Fact: Gun safety laws are constitutional.

Courts across the country have ruled, repeatedly, that the Second Amendment does not stand in the way of passing stronger gun laws.

The only thing standing in the way of laws https://t.co/ZrNT1iRA84",support,no,train
1374441969766727681,https://t.co/3wjxXznpvv,"Ban military-style assault rifles (which are designed to kill lots of humans rapidly) and enact commonsense gun safety reforms. 
#BanAssaultWeaponsNow https://t.co/3wjxXznpvv",support,yes,train
1340783552041005056,https://t.co/ZIn9A6A324,"Some people love to point to Chicago as evidence that gun safety laws don’t work. In reality, it proves why we need strong federal gun laws—most guns used in crimes in the city can be traced to outside states like Indiana with weak gun laws. https://t.co/ZIn9A6A324",support,no,train
1330915948983939072,https://t.co/Jsxj2rhwNA,"#guns #2A Gallup: Support for Gun Control has Dropped and It’s Not a Priority for Americans: After a year of COVID uncertainty, civil unrest, and record gun sales, support for further firearms restrictions has reached its lowest https://t.co/Jsxj2rhwNA https://t.co/JfYqSOtuiu",oppose,no,train
1340570930506944512,https://t.co/vVANYkVaHh,Gun control is fucking stupid https://t.co/vVANYkVaHh,oppose,no,train
1312688836372242435,https://t.co/LRoYlzLnHl,"Instead of leading, Trump is scaring masses of people into buying guns to 'protect' themselves. #care2 https://t.co/LRoYlzLnHl 
Arming Teachers Is NOT Common Sense Gun Reform #care2 https://t.co/v9uPQE1egj https://t.co/jrsNGyOxHc",support,no,train
1354796527324114946,https://t.co/5DD9RQa0b4,#thursdaymorning Maryland @MomsDemand volunteers are showing up for #MDGA2021 today to make our voices heard about legislation that will save lives from gun violence. We are the #gunsensemajority We will fight to protect MD from gun violence! #ExpectUs #MDPolitics @shannonrwatts https://t.co/5DD9RQa0b4,support,no,train
1368913254668509185,https://t.co/dObAJZlcYI,"The execution of Casey Goodson Jr shows how law enforcement doesn't believe 2nd amendment gun rights apply to Black people in America. If it did, Deputy Jason Meade would not have shot Casey six (6) times in the back. Meade's still free. The @NRA &amp; US ""Justice"" system are a joke https://t.co/dObAJZlcYI",oppose,yes,train
1374043991847616512,https://t.co/53OfZmx2mW,"Guns scare the shit out of me. Fun in a controlled environment, not much fun in the street. Living in Chicago (not the suburbs) gun violence is part of my everyday. A recent study of this power icon. https://t.co/53OfZmx2mW #nftcollector #nftart #cryptoart #gunviolence https://t.co/yrmmW94q96",support,yes,train
1323832745584447488,https://t.co/UzFl8jr06W,"Votes are in, and congrats @AnthonyBrownMD4! 

Maryland voters just re-elected a gun safety champion to Congress! Anthony’s commitment to the cause of gun safety makes us confident that he will fight to ensure the safety of our communities. #MD04 https://t.co/UzFl8jr06W",support,no,train
1344849626445168640,https://t.co/P81f9AH4GI,"Here’s what a Murderer does. Mass murder in public schools in order to bring about gun control laws. With guns tight, he is not concerned about a newly forming militia out in the public. With their arms out of reach, he is confident he has gained the nation. Then. He plans it. https://t.co/P81f9AH4GI",oppose,no,train
1372910857064173577,https://t.co/LZ2o9nRj7W,"Everyone knows that #guns don't kill #people. People kill people. That's why we send soldiers into battle armed with spoons, which are also good to eat with. Guns and Amerikan Kultur, Revised Version. https://t.co/LZ2o9nRj7W  #AtlantaMassacre #massageparlors #GunControl https://t.co/Te3IVb3lc9",oppose,no,train
1368660279723237381,https://t.co/aE7Ib27SBu,"Have you heard of ghost guns? We have! They are a new, dangerous type of firearm. Many of the guns are not traceable. Good for Los Angeles! #endgunviolence https://t.co/aE7Ib27SBu https://t.co/0CFwJnqlGm",support,no,train
1366845529909420032,https://t.co/lBLnhpMSFI,"Sen Murray, when it comes to 2nd Amendment issues You And your staff can’t tell the difference between a gun sight and a butt stock. You’re all failing to support your constituents with your ignorant stance! https://t.co/lBLnhpMSFI",oppose,yes,train
1374725248550076419,https://t.co/zI3YdbzFEO,"For those chickens in Congress too scared to take action on gun safety, even when over 80% support it, the usual #thoughtsandprayers aren't going be enough this time…
https://t.co/zI3YdbzFEO https://t.co/qFBI4deQMr",support,no,train
1321244809772912642,https://t.co/Qf8WUKprGq,"Gun folks, watch this @NRA video to the end...it's worth it.

Triggered: Church shooting heroes rip Biden gun control as ‘insane’ https://t.co/Qf8WUKprGq https://t.co/ziSVy1muXP",oppose,no,train
1374702164304662528,https://t.co/u5Mdm0PUjQ,"Yet, Congress and state legislatures across the land will fail to act. #gunreformnow #gunsense https://t.co/u5Mdm0PUjQ",support,yes,train
1323748106467422209,https://t.co/mLpXDv5SVu,"I support science, human rights, public education, affordable health care, immigrants and refugees, freedom of speech, freedom of press, and religion, choice, civil rights, gun control, with liberty and justice for all. #GoVote #HumanRights https://t.co/mLpXDv5SVu",support,no,train
1337140151521140736,https://t.co/NmfJWnbpyN,"Our Founders 🇺🇲🇺🇲🇺🇲 added the 2nd Amendment for the ""security of a free state."" Politicians wanting to disarm Americans have questionable motives. Learn more about #2A and more with the award-winning ""In Search of Liberty"" 🎦 Constitution movie ➡️ https://t.co/NmfJWnbpyN https://t.co/ePhYJJcixB",oppose,no,train
1314263050699116544,https://t.co/eapXky4sh7,"Every day, 100 people are shot and killed. 40,000 are killed each year. But Judge Barrett would rule to gut both our gun safety laws and our access to healthcare.  We don't need a reckless, undemocratic nominee who threatens our livelihoods! #WeDissent #BlockBarrett https://t.co/eapXky4sh7",support,no,train
1363919021817683975,https://t.co/dFLqJNE8tV,"To End Gun Violence – Does President Biden's Gun Policy Go Far Enough?  We need to end gun violence now… background checks are not the final answer.  Let’s make sure we push for less guns on our streets… because that means less gun violence!

#endgunviolence #secondamendment https://t.co/dFLqJNE8tV",support,yes,train
1370725799767248902,https://t.co/r7AuW8jRxJ,"2nd amendment works CUZ we never know if a citizen is armed or has arms in their home. 
NOT knowing who can shoot back keeps govt OVERREACH in check. @cspanwj

Biden's senate 30+ years ago created GUN FREE zones and guess what, KNOWING NO ONE CAN SHOOT BACK LEADS to MASSACRES. https://t.co/r7AuW8jRxJ",oppose,no,train
1340759489968918529,https://t.co/IUI0vRGeuf,"Participating in gun buy back program  is violation of our constitution. Los Angeles uses soft POWER to take away guns in exchange for up to $200 gift cards. Whether it is hard POWER or soft POWER, it is used against the #2ndAmendment 
Wake up America! 
@JeffGorell @MayorOfLA https://t.co/IUI0vRGeuf",oppose,no,train
1369371125583581191,https://t.co/QQ65QR9aQa,"The gun violence epidemic in America must be addressed.

According to the CDC, more than 38,000 deaths from firearms occurred in the US in 2016 and nearly 85,000 injuries from firearms occurred in 2015.

Congress needs to pass H.R. 8 as soon as possible.

#ONEV1 #GunSense https://t.co/QQ65QR9aQa",support,yes,train
1338571472411955207,https://t.co/m1LRatxTym,"On this painful anniversary, we remember the victims of the #SandyHook Elementary School shooting. New York State has made strides in our gun safety laws, and I'm committed to doing more to ensure our children &amp; families are safe from tragic &amp; preventable mass gun violence. https://t.co/m1LRatxTym",support,no,train
1348663586592317449,https://t.co/ZKEsvtRHA9,"I understand the desire to want do something about gun violence in America, but passing more restrictive laws actually make it harder on the law abiding &amp; easier for criminals. 

Defund Gun Control
➡️ https://t.co/ZKEsvtRHA9

GUNS ARE ESSENTIAL
➡️ https://t.co/INj7g4NWo8 https://t.co/OR0rknWGIG",oppose,yes,train
1370072580221206538,https://t.co/bQ0fvUvXy1,"Gun violence is a public health crisis, disproportionately impacting Black &amp; Brown communities. I wear orange to recognize all those impacted by #GunViolence and demand Congress take action by passing background check legislation. https://t.co/bQ0fvUvXy1",support,no,train
1325155319522054145,https://t.co/8YC5royyyL,".@KamalaHarris just made history as the first Black woman and first Indian-American woman to win the US vice presidency!

VP-elect Harris ran on the strongest gun safety ticket in US history alongside @JoeBiden. With their leadership, gun safety bills can become gun safety laws. https://t.co/8YC5royyyL",support,no,train
1365369885216313344,https://t.co/pobkN3QfGJ,"They are designed to effectively and immediately incapacitate ANY threat, foreign or domestic. 2nd Amendment is not just for hunting or shotguns. It’s to afford ALL civilians the greatest weapons of war to protect the people from the tyranny of government. Fuck your feelings. https://t.co/pobkN3QfGJ",oppose,no,train
1375190848883863553,https://t.co/vNEGJVfPqQ,"🚨NEW PRODUCT🚨 
Check out our brand new TRYBE Optics DiMA1000 Laser Rangefinder!

Featuring distance knowledge into your firearm system with minimal disruption to your shooting position, allowing the operator to shoot more quickly, calmly, and accurately! https://t.co/vNEGJVfPqQ https://t.co/7thxoKbCki",oppose,no,train
1343215497333059586,https://t.co/I0op31MXeF,Mexico Proves More Gun Control Does Not Mean Less Crime https://t.co/I0op31MXeF #FFMVA https://t.co/xjpbh5mqQJ,oppose,yes,train
1361104442096050176,https://t.co/KONIZWlP8u,"Biden calls for the complete destruction of 2nd amendment. What I don't get is that if he wants to ""save lives"", why won't he ban cigarettes? Cigarettes cause 10x more death a year and to those who say ""well it's a personal choice"" how come more people die of second hand smoke https://t.co/KONIZWlP8u",oppose,yes,train
1314260551183327234,https://t.co/hcTHWFtTI6,"Every year, 40,000 people in America are killed with guns. Think about those healthcare costs— it's astronomic. And lifelong. We cannot afford another Supreme Court justice who will roll back both gun safety laws and our healthcare access. #BlockBarrett #WeDissent #EndGunViolence https://t.co/hcTHWFtTI6",support,yes,train
