tweet_id,tweet_url,tweet_text,stance,persuasiveness,split
1360767951331188736,https://t.co/oU1sBN3enb,"The Second Amendment discussion that needs to be had:

1. Guns should be banned for civilians because ... guns are capable of significant lethal damage. 

That's why we have police - to protect the people. 

2. Most people: https://t.co/oU1sBN3enb",support,yes,train
1372266327814049793,https://t.co/TAvRArHjZG,"There are nearly 400 million firearms in the US, controlled very well by over 150 million legal owners. We don’t need the government to control us. The laws you push don’t deter criminals. The 2nd Amendment protects us from government control. https://t.co/TAvRArHjZG",oppose,no,train
1374720661264957446,https://t.co/aqGu0EmPht,"Gun control does not work, and all it accomplishes is the infringement of our constitutional rights! #2A #MolonLabe https://t.co/aqGu0EmPht",oppose,yes,train
1361493928466391043,https://t.co/szFpwyNTW1,I really need to purchase my AR 15 that i have wanted for the past 6 years before the gun control wave. Also need to get a conceal carry. And a gun safe. Cause gun safes are common sense gun safety. @Springfield_Inc  this is an absolute beauty. Yes i know its an AR 10 platform. https://t.co/szFpwyNTW1,oppose,yes,train
1368911467391631361,https://t.co/vLvjATpCcj,"The GOP argument against gun safety laws is that they only affect law abiding citizens because criminals don't follow the law.

H.R. 8 does not affect any law abiding citizens because they would pass a background check. H.R. 8 will close loopholes criminals use.

#ONEV1 #GunSense https://t.co/vLvjATpCcj",support,no,train
1375607639623671811,https://t.co/v2OlLDVOyL,To the firearm ignorant Joe-MENTIA Biden and his circus of clowns it's the scarrrrry looks of an 'SEMI AUTO ASSAULT RIFLE' that make it so dangerous. Which 'SEMI AUTO ASSAULT RIFLE' do you suppose they're talking about ? Which one is the most lethal ? #Tucker https://t.co/v2OlLDVOyL,oppose,no,train
1361344803380813829,https://t.co/NuruKwbzib,"Our #MondayMotivation is to urge #MDGA21 to prioritize legislation to prohibit the manufacture &amp; sale of ghost guns. These do-it-yourself weapons can be downloaded or purchased online, bypassing the background check system that keeps Maryland safe. @MomsDemand #MDPolitics https://t.co/NuruKwbzib",support,no,train
1327940679218192385,https://t.co/LRoYlzLnHl,"Instead of leading, Trump is scaring masses of people into buying guns to ‘protect’ themselves. #care2 https://t.co/LRoYlzLnHl 
Arming Teachers Is NOT Common Sense Gun Reform #care2 https://t.co/v9uPQE1egj https://t.co/NIiCjGtF7Q",support,no,train
1355609696200237059,https://t.co/doam68KW2u,"For decades, the NRA has peddled the far-right's dangerous conspiracy theories, spread fear to sell more guns, fought life-saving gun safety measures at every turn, and promoted dangerous gun bills at the state and federal level.
https://t.co/doam68KW2u https://t.co/o0QRkCBPp6",support,no,train
1374361433375436808,https://t.co/lqAufd0zEs,"Another unnecessary killing spree in USA. All those Americans moaning about their 2nd Amendment right - have they ever even read it? Do they consider themselves ""Militia""? Can't they see it has NO relevance to a democracy in 2021? #EndGunViolence #2ndAmendment #BoulderColorado https://t.co/lqAufd0zEs",support,yes,train
1367880730873827328,https://t.co/MFLx6cRwiY,"GiffordsCourage: Gun law loopholes cost lives. Up to 80% of guns used for criminal purposes were obtained without a background check—we can’t put any more Americans at risk. 

Tell your representative to support #HR8, the Bipartisan Background Checks Act… https://t.co/MFLx6cRwiY",support,no,train
1346983759376125953,https://t.co/rN5WcU0CRq,It would be greatly useful the next time school children are petitioning congress for gun reform to haul up pictures of everyone in congress crawling on the floor in abject terror today. https://t.co/rN5WcU0CRq,support,no,train
1321104758833401857,https://t.co/ZywpxtvcYl,"This election, a lot is on the line. DFLers are ready to secure affordable and accessible health care, pass common sense gun safety laws, address climate change, and ban conversion ""therapy"" - but we can only do that with a Senate DFL Majority. https://t.co/ZywpxtvcYl",support,no,train
1315369824068005890,https://t.co/WFDghhkgFx,"#GunControl was recognized in 1949 BY A LIBERAL as ineffective at controlling the criminal population. Yet #Democrats persist in it. They have been ""steering"" education and entertainment for 80 years. 
https://t.co/WFDghhkgFx
https://t.co/WFDghhkgFx https://t.co/laKd6HIbD6",oppose,no,train
1363623799095189505,https://t.co/BI9zOsNXh0,"#DonJr will you ever learn!!!! You silly, silly, man child! Making videos in front of a wall full of guns does not make you look cool or tough  - it just makes you tone deaf to the climate of gun control to prevent school shootings in this country. https://t.co/BI9zOsNXh0",support,no,train
1322632548414083072,https://t.co/nkT3oQ3rPl,A graveyard full of people who lived long lives is not as scary as losing a loved one to gun violence. Vote for #gunsense candidates. #halloween ⁦@MomsDemand⁩ https://t.co/nkT3oQ3rPl,support,no,train
1364706430264123396,https://t.co/6kxgsgPH9S,"Really stupid politicians are totally unaware that gun control is impossible at this stage of the game. Tracking serial numbers? Guns can be had without serial numbers.

Hassling legal gun owners is futile. https://t.co/6kxgsgPH9S",oppose,yes,train
1366484992327622656,https://t.co/DdMfXjlprs,"Joe Biden says that guns are a threat to government.

If Democrats succeed and infringe on the 2nd amendment, America as a Constitutional Republic is lost!

6pm Tim Aalders, guest host on The Voice of a Nation:

LIVE https://t.co/DdMfXjlprs 
iHEART RADIO https://t.co/wL2aevicfL https://t.co/MUcALbqSUO",oppose,no,train
1362062491124170754,https://t.co/PcNyMW3NzD,"KY @MomsDemand are ready for another meeting with a legislator to discuss @SenatorHornback and @MorganMcGarvey 's CARR Bill229,: Crisis Aversion and Rights Retention bill. It will help curb gun suicides, that comprise 66% of KY's gun deaths. 

#ExpectUs
#KYGA21 #KYLeg 
@Everytown https://t.co/PcNyMW3NzD",support,no,train
1333532024188116992,https://t.co/NKTDZcGHoN,"In addition to fighting against commonsense gun safety legislation that will save thousands of lives, which has the overwhelming support of all Americans, you can add tax cheats that steal their members money to the list of the NRA's recent achievements.  
https://t.co/NKTDZcGHoN https://t.co/azTUt5Sfzf",support,no,train
1363284939106476034,https://t.co/PiVNeZtj4l,"New Mexico: Mandatory Gun Storage &amp; Youth Firearms Possession Ban To Be Heard in Senate Committee on Wednesday!: Another legislative session -- another ineffective, intrusive and unenforceable gun control proposal.  You wonder what they'll come up with… https://t.co/PiVNeZtj4l https://t.co/udoW2FrYX5",oppose,no,train
1372295878665404417,https://t.co/x63shNJCOs,"Gun Safety Champion @sandra4nv presented #AB286 to (1) ban ghost guns, unserialized parts sold in kits and the weapon of choice for criminals, and (2) allow businesses the choice to prohibit guns on their property. Nevada @MomsDemand vols say #nvleg, pass it! https://t.co/x63shNJCOs",support,no,train
1365041005079253000,https://t.co/OOUrNWJHF4,"Here that, guys? We only have to wait until 2099 and then we MIGHT get some gun control laws! https://t.co/OOUrNWJHF4",support,yes,train
1344376758292934656,https://t.co/iacfnI1XZ7,"“Gun control is like trying to reduce drunk driving by making it tougher for sober people to own cars.”
– Anonymous
 👉  https://t.co/iacfnI1XZ7

#CCW #gun #countrywideconcealed #certifiedCCW #NV #USA #weapons #weapon #proguns #guns #instaguns #concealedcarry #gunquotes https://t.co/nMdOK45Gmm",oppose,no,train
1351479939812323328,https://t.co/8WmnKGtn47,"""You don't need weapons of war to protect yourself!""
*Proceeds to surround themselves with weapons of war to protect themselves
#2ndAmendment #GunControl https://t.co/8WmnKGtn47",oppose,no,train
1340138048827379715,https://t.co/NJQ5pif8Th,FPC Challenges #California’s ‘1-in-30’ Firearm Purchase Ban in New Second Amendment Lawsuit: https://t.co/NJQ5pif8Th #2A #RKBA #LegalAction https://t.co/cWJM7x3Ahy,oppose,yes,train
1336027200714313737,https://t.co/icvgC7NDA6,"""I know what's comin'. The gun control nuts will be crawling out of the woodwork."" Pat Crowley, Palm Beach Post, 12/10/1980. #JohnLennon https://t.co/icvgC7NDA6",oppose,no,train
1342857647326961664,https://t.co/hBAV1pPCY9,#guns #2A 6-Time Olympic Shooting Medalist Says Gun Control Is ‘Killing Our Sport’: Six-time Olympic shooting medalist Kim Rhode said Monday night that new gun control measures implemented in her home state of California — an https://t.co/hBAV1pPCY9 https://t.co/0zznHOPCN1,oppose,no,train
1370298806705606659,https://t.co/aQSNolBisN,"GET YOUR FREE T-Shirt For 2nd Amendment Supporters! ""When Guns Are Outlawed, I'll Be An Outlaw""
https://t.co/aQSNolBisN https://t.co/lWHfQFz91t",oppose,no,train
1320732162702733312,https://t.co/4DFpPXORys,"Barbara Bollier supports common sense gun control, while Marshall wants to do nothing and let things get out of control. Safety should always be top priority. Another reason why I voted for Barbara Bollier, and you should too! 👍 https://t.co/4DFpPXORys",support,no,train
1334486617587933185,https://t.co/StSMgnuymK,⁦@JoeBiden⁩ ⁦@KamalaHarris⁩ you may need a history lesson before you start pushing harder on gun control. Guns have made to world more peaceful. Learn you history! https://t.co/StSMgnuymK,oppose,no,train
1362537564297568258,https://t.co/VXWlSvGGMi,Biden and Harris want to infringe on our rights to keep and bear arms. The only common sense gun laws are those which allow citizens to keep and bear arms and ammo. @laurenboebert you are a great voice. Don’t stop. #GunControl #BidenRemorse #2A https://t.co/VXWlSvGGMi,oppose,yes,train
1346916067923398672,https://t.co/DpSZwWFvOs,"Maybe now Congress will understand the fear that griped Columbine, Parkland, Newton.  Fear every parent and educator in the country has when they head to school to work or drop off their child. #GunSense @MomsDemand @shannonrwatts https://t.co/DpSZwWFvOs",support,no,train
1373119570584743938,https://t.co/TfNsqgJGnX,I mean really? Its a modern day Barney Fife..lets not mention the shotgun in the shoulder of the front cop!!! no wonder you need qualified immunity with geniuses like these on the streets GUN SAFETY SAVES LIVES!!! https://t.co/TfNsqgJGnX,support,yes,train
1364432732764348417,https://t.co/RJCnMds4Er,"A gun-rights organization said that President Joe Biden’s gun control proposal would potentially make about 105 million law-abiding gun owners into criminals.
https://t.co/RJCnMds4Er https://t.co/Zfwf7ZwS5a",oppose,no,train
1323841854421557249,https://t.co/GchRbB4lZZ,"Congratulations @KatherineClark for winning your re-election to represent #MA05 in the U.S. House of Representatives!

We are one step closer to bringing true common-sense gun safety legislation so our children can have a future free of gun violence. https://t.co/GchRbB4lZZ",support,no,train
1322439663576113152,https://t.co/DFraeUWVvJ,Gun Control the theory that becoming a victim is somehow morally superior to defending your family! #Safecitizen #Selfdefence https://t.co/DFraeUWVvJ,oppose,no,train
1374419077431652364,https://t.co/aQXuEnYHgq,Joe Manchin is a traitor to both the American citizen and the Democratic Party. He might as well be a Republican lapdog to Trumpism. Sensible gun reform and lawful background checks could have prevented the Colorado shooting. Innocent lives are at stake. #EndGunViolence https://t.co/aQXuEnYHgq,support,no,train
1370104245266042889,https://t.co/nygK2deKwy,You are a PofS. 2nd amendment guarantees the right to protect ones property. It does not guarantee the right to take a gun from Florida to New York. It guarantees the right ro own a muzzle loader rifle not an AR15! https://t.co/nygK2deKwy,support,yes,train
1357804885899624449,https://t.co/rEMdpM2W4H,Equally as important as defeating and isolating extremist ideologies is prohibiting the EASY access to #guns and other weapons that these people can use to inflict violence #gunsense #gunsafety @SpeakerPelosi @SenSchumer @Sen_JoeManchin @AmbassadorRice @RonaldKlain https://t.co/rEMdpM2W4H,support,no,train
1344635368528871425,https://t.co/HzI1Qsm2LP,"Once again we cannot thank our members, supporters, and donors for making NJ2AS the largest and most effective Second Amendment organization in NJ! Without your support we would have never been able to fight NJ’s tyrannical government this year and have gun stores and ranges https://t.co/HzI1Qsm2LP",oppose,no,train
1325891480863563783,https://t.co/d2lQYKJ1hV,"GUN SAFETY WIN! Moms Demand Action Gun Sense Candidate @SpanbergerVA07 has been re-elected to represent Virginia’s 7th Congressional District!

Congratulations, Rep. Spanberger! https://t.co/d2lQYKJ1hV",support,no,train
1347926565070512128,https://t.co/qrLetGFUO3,"when did school shootings commence? 

  [GUN FREE] violates 2nd amendment logic .. 

Plus like the boy in Florida, FBI had been warned about him by several people. Why was he not 'helped' as an orphan with mental issues vs allowed to go to public high school. @cspanwj https://t.co/qrLetGFUO3",oppose,no,train
1346517792082673664,https://t.co/VT7groNgBm,"A yr of rioting, cop-bashing and threatened gun grabs shattered records in terms of #firearm sales &amp; background checks https://t.co/VT7groNgBm

But just owning a gun isn't enough, folks. Keeping it requires vigilance in defense of your #2ndAmendment rights https://t.co/lStgm8Wdek https://t.co/HaT93LpyE4",oppose,no,train
1318950066942607370,https://t.co/G0WOQNDPnL,"RT MaxRose4NY ""Gun violence has plagued our country for far too long. Common sense gun safety can and must happen. Weapons of war don’t belong on our streets. I’m proud to be supported by those taking on the corporate gun lobby to end gun violence. https://t.co/G0WOQNDPnL""",support,no,train
1347386004114612229,https://t.co/KRnrutrgmG,None of this goes away until we disarm white supremacists and enact strict gun laws that prohibit the personal possession of long guns and paramilitary equipment. #GunSense https://t.co/KRnrutrgmG,support,yes,train
1367169170614358016,https://t.co/tLrGI7n9HY,"Like nearly every other new ""reasonable"" gun law, this does nothing to address crime and everything to punish legal gun owners and hobbyists. 90% of guns used in crimes are stolen, found, or obtained on the street. Criminals don't need to ""make ghost guns"", they steal guns. https://t.co/tLrGI7n9HY",oppose,no,train
1374355731005198338,https://t.co/LDYguIO4Xi,“How many people died in Chicago last weekend from gun gang violence?” “We need to do something about these inner city gangs!” “the problem is the illegal guns that gang members use!” Said absolutely no Liberal ever!!!#2ndAmendment #GunReformNow AR-15 https://t.co/LDYguIO4Xi,support,no,train
1374316740121878529,https://t.co/A62eGcSCBs,"a person's right to kill is more protected than a person's right to live.
END GUN VIOLENCE
#Colorado #EndGunViolence https://t.co/A62eGcSCBs",support,yes,train
1322994060227989505,https://t.co/0CUGgccrAW,"Two days. That's all we have left to elect gun safety champion @JoeBiden and oust NRA puppet Donald Trump.

No more lethal inaction: Joe Biden &amp; @KamalaHarris will prioritize common-sense solutions to prevent gun violence and save lives. Go vote! #EndGunViolence #BidenHarris2020 https://t.co/0CUGgccrAW",support,no,train
1351628704267579395,https://t.co/leUBgIAFA0,STATE AND OR FEDERAL MANDATED CONCEALED CARRY PERMITS ARE JUST ANOTHER (INFRINGEMENT) ON THE SECOND AMENDMENT AND IS AGAINST THE SUPREME LAW OF THE LAND... https://t.co/leUBgIAFA0,oppose,no,train
1375447448445988866,https://t.co/rGWSdFYEKN,"Kids exposed to gun violence often experience trauma and other psychological effects. When they open up about their experiences, show your support by listening attentively to validate their feelings and let them know they're not alone.

#GunViolence #Listening https://t.co/rGWSdFYEKN",support,no,train
1364724222627639296,https://t.co/n6P6oyKCPF,"Biden Gun Control Plan Would ‘Criminalize’ up to 105 Million People: Gun-rights Group - https://t.co/n6P6oyKCPF

By Jac... https://t.co/ArPuMP20Cj",oppose,no,train
1339440670273105920,https://t.co/lZFmT9qTRB,This is the kind of sensible gun control I can fully support! https://t.co/lZFmT9qTRB,oppose,no,train
1347499329456463872,https://t.co/MsSte7i69r,"Free will, is how, Jay-Bob @GovInslee. You can't legislate it away.

Welcome to Real Life. It's why we have a Second Amendment. WSP protects you, 24/7, on our dime.

Meanwhile, your party wants to disarm us, while you force us into poverty.

Maybe dial it back, idiot.

#WA2A https://t.co/MsSte7i69r",oppose,no,train
1362580870754885636,https://t.co/ZI6WgwAK9w,"Georgia @MomsDemand and #StudentsDemand volunteers showed up for #GAPol VIRTUALLY today to make our voices heard about legislation that will save lives from gun violence. We are the #gunsensemajority, we will fight to make sure our lawmakers protect Georgia from gun violence! https://t.co/ZI6WgwAK9w",support,no,train
1344073616284131329,https://t.co/OQMx5LGkRH,Criminal violence has increased on the Liberals watch because of failed ‘hug a thug’ rehabilitated legal ideology; stricter gun controls; catch and release ‘progressive’ judges and a failure of real crime control action by Public Safety Minister Bill Blair. https://t.co/OQMx5LGkRH,oppose,yes,train
1333897793992347653,https://t.co/XRFwDDtd4H,"Ahh...but who needs rational gun laws....WE DO. But only if we WANT TO SAFE LIVES &amp; decrease injuries, decrease healthcare costs, save children from exposure to gun violence...decrease fear...your answer here. #rationalgunlaws ⁦@ProtectMN⁩ https://t.co/XRFwDDtd4H",support,no,train
1366042118930726915,https://t.co/g1LHX2zFX4,“All Gun Control Is Racist.” https://t.co/g1LHX2zFX4,oppose,no,train
1361663724940111873,https://t.co/Swh0pkSUlv,"♦️ This is a bonus picture. Gizzie isn't having it. She can't understand that on average, 728 Kentuckians die due to guns every year. Safe storage laws and sensible legislation can reduce these deaths. So... let's talk to Legislators TODAY!

#KYGA21 #KYLeg @MomsDemand @Everytown https://t.co/Swh0pkSUlv",support,no,train
1371535699795570691,https://t.co/DphklTwFq8,"No more gun control, we need less gun control. Our 2nd amendment Rights have already been trampled on by the laws we have! https://t.co/DphklTwFq8",oppose,yes,train
1371589871375159296,https://t.co/vyNkcKhHFi,"Strict gun rules/bans means the bad guys run rampant over the defenseless sheeple!  Chicago has 1 of strictest gun control measures in the country.  

Proof stricter gun laws IS NOT THE ANSWER.  Protect the 2A rights of the law abiding majority. https://t.co/vyNkcKhHFi",oppose,no,train
1357931603872288768,https://t.co/xYijdKEZmM,"Biggest Gun Control Bill In History #Targets The Poor, Will Make Millions Of Felons Overnight

https://t.co/xYijdKEZmM https://t.co/R5WtcfJrFJ",oppose,no,train
1330377844073979904,https://t.co/a6VNIsC3wi,"Myth: Gun Control Reduces Crime Myth: Gun Control Reduces Crime

From ABC 20/20 Myths, Lies, https://t.co/a6VNIsC3wi https://t.co/xnqpadqXxV",oppose,no,train
1367512810381602819,https://t.co/5LZF1QrDjC,"”The world is filled with violence. Because criminals carry guns, we decent law-abiding citizens should also have guns. Otherwise they will win and the decent people will lose.” -James Earl Jones 

#Firearm #Ammo #Protect #Guns #Carry #2ndAmendment #TheRightToCarry #Ammunition https://t.co/5LZF1QrDjC",oppose,no,train
1325114360440696834,https://t.co/o3fFhj2GAr,"🚨HISTORIC WIN🚨
 
Congratulations President-elect, @JoeBiden! From passing the original Brady Background Check Bill to implementing the Assault Weapons Ban - you've repeatedly taken on the NRA and proven to be the gun safety champion America needs.
 
Now, let’s get back to work! https://t.co/o3fFhj2GAr",support,no,train
1340060574928015362,https://t.co/PzDw02pImr,"The Fight for Georgia @ReverendWarnock &amp; @ossoff 

Gun safety laws are on the line that will save lives. We need your help to elect both these Gun Safety Champions

Text GEORGIA to 34131 to donate $

Text PEACH to 64433 to make calls to flip the Senate with @MomsDemand https://t.co/PzDw02pImr",support,no,train
1375303070477922304,https://t.co/bIxEpZQROW,"Prison shanks

because even in the most secure gun free environment possible evil people find a way to kill

#2AShallNOTBeInfringed 
NO #GunControl https://t.co/bIxEpZQROW",oppose,no,train
1374865621960249345,https://t.co/09L9W8pfV3,"Guns don't kill people. People kill people. Take away the guns, and they'll use knives, and so on. #ejforliberty #guncontrol #guns #2a #gunrights #2ndamendment #ar #guncontrolnow #shallnotbeinfringed #firearms #enoughisenough #secondamendment #gunsofinstagram #nra #gun https://t.co/09L9W8pfV3",oppose,no,train
1372925432870404098,https://t.co/1AFKJ5p0cc,"In France -my 2nd country- there are VERY STRICT gun control laws.
ALMOST NO ONE HERE owns one, and there are VERY FEW mass shootings or gun deaths.
The US is the 3d country in the world with the highest rate of gun deaths... WE MUST FIX THAT !!
#GunControlNow https://t.co/1AFKJ5p0cc",support,no,train
1366992335008010241,https://t.co/gjMY3GzU1u,"We should be concerned if H R 127 bill passes
Remember gun control laws do not solve the issue because the biggest incidents occur with illegal gun owners 
This is a violation of our 2nd Amendment rights  
https://t.co/gjMY3GzU1u
https://t.co/e8AXI473j9
https://t.co/IivQvkS93n https://t.co/JmJDEYTL1s",oppose,no,train
1372169680945868808,https://t.co/0GNYg4vHk2,Every act of gun violence is a preventable one. Take the Pledge to promise to.. 1)Look for warning signals and threats 2) Act immediately and take it seriously 3) #SaySomething to a trusted adult. By taking the pledge you are helping to create a safer and healthier school! https://t.co/0GNYg4vHk2,support,no,train
1334946681444450305,https://t.co/3JNcSq7Uye,"""We must act on climate change, push gun control, defund the police and legalize drugs. Because of COVID.""

These are liberals. This is who they are. This is how they behave. If you can find anything in their belief system that resembles a normal human being, I'd love to see it. https://t.co/3JNcSq7Uye",oppose,no,train
1370056928404078592,https://t.co/vj2sOS2wWf,"Join us on March 23rd for our gun safety virtual advocacy day! The gun violence epidemic is a public health issue, and legislators must treat it with the same urgency as they would any other crisis.

RSVP at the link for event details: https://t.co/vj2sOS2wWf https://t.co/oups0vxRQ1",support,no,train
1329470120620658689,https://t.co/eMgiELW7Fn,"Can't be true, Chicago has all the common-sense gun control measures the left wants.

If this were true, it would prove all those measures aren't actually doing anything good. https://t.co/eMgiELW7Fn",oppose,no,train
1365003891889364997,https://t.co/xCpCjtuIUv,Biden Gun Control Plan Would 'Criminalize' up to 105 Million People: Gun-rights Group https://t.co/xCpCjtuIUv https://t.co/znVcaKKR3o,oppose,no,train
1367869286073704453,https://t.co/W0KdVQsajd,"Gun law loopholes cost lives. Up to 80% of guns used for criminal purposes were obtained without a background check—we can’t put any more Americans at risk. 

Tell your representative to support #HR8, the Bipartisan Background Checks Act. Text UNIVERSAL to 34131 to call them. https://t.co/W0KdVQsajd",support,no,train
1375846571611394050,https://t.co/2Srdv89WS7,"Every life stolen whether it’s  to suicide, accidental shooting, homicide, or mass shooting leaves a family, and a community, irrevocably wounded. And, the magnitude of this uniquely American problem is almost unfathomable. #MoreThanThoughtsAndPrayers @MomsDemand https://t.co/2Srdv89WS7",support,no,train
1320775978533212166,https://t.co/MvavCX93Pl,".@ASL4Justice4all is a champion for our environment, especially our precious water. She backs common-sense gun safety rules to make our cities safer. She puts people first &amp; brings a passion &amp; intellect to state lawmaking that will ensure just &amp; fair laws. https://t.co/MvavCX93Pl https://t.co/aDF1dnG2Dz",support,no,train
1316117138076246017,https://t.co/t7wd7peLNh,Chicago tops 600 murders. Highest in 5 years. Chicago is a gun free zone. Gun control works so well. Idiots. https://t.co/t7wd7peLNh,oppose,no,train
1352720207412940802,https://t.co/v4emqwZAI6,Text PFVHLW to 50409 to tell Legislature that we don't want Strict Scrutiny in Iowa! This gun rights amendment proposal with strict scrutiny language would undermine all efforts to enact sensible restrictions on firearm access and could lead to current gun safety laws challenges https://t.co/v4emqwZAI6,oppose,no,train
1340680594594951169,https://t.co/X3E39UTS35,"#guns #2A Here’s A List Of Biden’s Pro-Gun Control Cabinet Picks: … rifles may be banned because they are, like the M-16, ‘weapons … absolute most anti-gun, anti-Second Amendment, anti-Constitutional AG … physician, cri https://t.co/X3E39UTS35 https://t.co/y7ezzhcEPL",oppose,no,train
1372921106793914368,https://t.co/hEXmv5VG5V,"There is no statistical evidence that the Brady Bill achieved anything it was created to.
#GunControl oppresses the law-abiding &amp; does nothing to improve the safety of our society.

#SelfDefense #GunRights https://t.co/hEXmv5VG5V",oppose,no,train
